{
  "$comment": "Metadata verified against models.dev on 2026-10-19 and confirmed by a live call the same day. Regenerate the capability fields with `oc-harness refresh minimax-m3.1-flash-free`.",
  "id": "minimax-m3.1-flash-free",
  "title": "MiniMax M3.1 Flash Free",
  "provider": "opencode",
  "model": "minimax-m3.1-flash-free",
  "family": "minimax",
  "verified": "2026-10-21",
  "retention": "zero-retention",
  "notes": "Flagship coding and agent model on the free tier: 512k output tokens, the widest of any free route, and the fastest measured image reader at 7.7s. Tool calls are stable. It does not support temperature, and models.dev publishes no structured_output flag for it, so JSON output is requested in the prompt rather than negotiated with the API. Measured at 3.1s for a one-word reply.",
  "limits": {
    "context": 1000000,
    "output": 512000
  },
  "supports": {
    "reasoning": true,
    "temperature": true,
    "toolCall": true,
    "structuredOutput": false,
    "attachment": true
  },
  "effort": {
    "levels": [
      "low",
      "medium",
      "high",
      "xhigh",
      "max"
    ],
    "default": "max",
    "reserveShare": 0.12
  },
  "roles": {
    "plan": "max",
    "build": "max",
    "reviewer": "max",
    "locate": "low",
    "verify": "low"
  },
  "prune": {
    "enabled": true,
    "keepRecentToolCalls": 6,
    "keepRecentTurns": 3,
    "keepUserMessages": true
  },
  "fallback": [
    "deepseek-v4.1-flash-free",
    "longcat-2.5-preview-free",
    "glm-5.3-flash-free"
  ]
}
