{
  "$comment": "Validated against models.dev on 2026-10-07. Regenerate with `oc-harness use --refresh`.",
  "id": "space-bunny-free",
  "title": "Space Bunny Free (OpenCode Zen)",
  "provider": "opencode",
  "model": "space-bunny-free",
  "family": null,
  "verified": "2026-10-07",
  "retention": "zero-retention",
  "notes": "Stealth preview reasoning model. Served over /v1/chat/completions (openai-compatible), which is the weaker cache dialect compared with models on /v1/responses. At the time of writing it is the only free model on Zen whose top reasoning effort is `max` and whose provider is zero-retention. Free for a limited time; expect the slot to rotate.",
  "limits": {
    "context": 1048576,
    "input": 524288,
    "output": 524288
  },
  "supports": {
    "reasoning": true,
    "temperature": false,
    "toolCall": true,
    "structuredOutput": false,
    "attachment": true
  },
  "effort": {
    "levels": ["low", "medium", "high", "xhigh", "max"],
    "default": "max",
    "reserveShare": 0.12
  },
  "roles": {
    "plan": "max",
    "build": "max",
    "reviewer": "max",
    "locate": "low",
    "verify": "low"
  },
  "prune": {
    "enabled": true,
    "keepRecentToolCalls": 6,
    "keepRecentTurns": 3,
    "keepUserMessages": true
  },
  "fallback": ["x-preview-f-free", "longcat-2.5-preview-free", "deepseek-v4-flash-free"]
}
