{
  "$comment": "Metadata verified against models.dev on 2026-10-19 and confirmed by a live call the same day. Regenerate the capability fields with `oc-harness refresh nemotron-3.5-lightning-free`.",
  "id": "nemotron-3.5-lightning-free",
  "title": "Nemotron 3.5 Lightning Free",
  "provider": "opencode",
  "model": "nemotron-3.5-lightning-free",
  "family": "nemotron-free",
  "verified": "2026-10-19",
  "retention": "may-train",
  "notes": "Its output cap equals its whole context window, so it is the lane for emitting a file larger than 128k tokens. It publishes no effort level, so it spends nothing on reasoning. It is usually the quickest lane on the tier - 3.7s average over four requests - but one measured call took 114s, so it is not on a latency-sensitive path.",
  "limits": {
    "context": 262144,
    "output": 262144
  },
  "supports": {
    "reasoning": true,
    "temperature": true,
    "toolCall": true,
    "structuredOutput": true,
    "attachment": false
  },
  "effort": {
    "levels": [],
    "default": null,
    "reserveShare": 0.12
  },
  "roles": {
    "plan": "max",
    "build": "max",
    "reviewer": "max",
    "locate": "low",
    "verify": "low"
  },
  "prune": {
    "enabled": true,
    "keepRecentToolCalls": 6,
    "keepRecentTurns": 3,
    "keepUserMessages": true
  },
  "fallback": [
    "big-pickle",
    "longcat-2.5-preview-free"
  ]
}
