{
  "$comment": "Metadata verified against models.dev on 2026-10-19 and confirmed by a live call the same day. Regenerate the capability fields with `oc-harness refresh mimo-v2.6-flash-free`.",
  "id": "mimo-v2.6-flash-free",
  "title": "MiMo V2.6 Flash Free",
  "provider": "opencode",
  "model": "mimo-v2.6-flash-free",
  "family": "mimo",
  "verified": "2026-10-22",
  "retention": "may-train",
  "notes": "Xiaomi. The only free model that publishes audio input, and it read an image correctly in a live call, at 19.2s average - the slowest lane on the tier, and slower than minimax on the same picture. OpenCode 1.19 refuses to read a binary file at all, so the audio path is not reachable through the harness today; the vision path is. No effort levels, so no variant is written.",
  "limits": {
    "context": 200000,
    "output": 32000
  },
  "supports": {
    "reasoning": true,
    "temperature": true,
    "toolCall": true,
    "structuredOutput": false,
    "attachment": true
  },
  "effort": {
    "levels": [],
    "default": null,
    "reserveShare": 0.12
  },
  "roles": {
    "plan": "max",
    "build": "max",
    "reviewer": "max",
    "locate": "low",
    "verify": "low"
  },
  "prune": {
    "enabled": true,
    "keepRecentToolCalls": 6,
    "keepRecentTurns": 3,
    "keepUserMessages": true
  },
  "fallback": [
    "minimax-m3.1-flash-free"
  ]
}
