{
  "$comment": "Metadata verified against models.dev on 2026-10-19 and confirmed by a live call the same day. Regenerate the capability fields with `oc-harness refresh longcat-2.5-preview-free`.",
  "id": "longcat-2.5-preview-free",
  "title": "LongCat 2.5 Preview Free",
  "provider": "opencode",
  "model": "longcat-2.5-preview-free",
  "family": "longcat",
  "verified": "2026-10-19",
  "retention": "zero-retention",
  "notes": "Meituan. 1M context with image input, and a reasoning toggle rather than a tier, so no variant is written. It read a screenshot correctly in a live call, which is what makes it the zero-retention fallback for the vision lane. Measured at 9.4-13.2s. A preview endpoint: it can be withdrawn without a rename.",
  "limits": {
    "context": 1000000,
    "output": 131072
  },
  "supports": {
    "reasoning": true,
    "temperature": true,
    "toolCall": true,
    "structuredOutput": false,
    "attachment": true
  },
  "effort": {
    "levels": [],
    "default": null,
    "reserveShare": 0.12
  },
  "roles": {
    "plan": "max",
    "build": "max",
    "reviewer": "max",
    "locate": "low",
    "verify": "low"
  },
  "prune": {
    "enabled": true,
    "keepRecentToolCalls": 6,
    "keepRecentTurns": 3,
    "keepUserMessages": true
  },
  "fallback": [
    "minimax-m3.1-flash-free",
    "deepseek-v4.1-flash-free",
    "beam-free"
  ]
}
