{
  "$comment": "Metadata verified against models.dev on 2026-10-19 and confirmed by a live call the same day. Regenerate the capability fields with `oc-harness refresh deepseek-v4.1-flash-free`.",
  "id": "deepseek-v4.1-flash-free",
  "title": "DeepSeek V4.1 Flash Free",
  "provider": "opencode",
  "model": "deepseek-v4.1-flash-free",
  "family": "deepseek-flash",
  "verified": "2026-10-22",
  "retention": "zero-retention",
  "notes": "Reasoning plus agentic coding plus structured output on a zero-retention provider. The natural schema lane. Its knowledge cutoff is 2025-05, the oldest of the tier, so it is not the lane for anything that depends on recent facts.",
  "limits": {
    "context": 200000,
    "output": 32000
  },
  "supports": {
    "reasoning": true,
    "temperature": true,
    "toolCall": true,
    "structuredOutput": true,
    "attachment": true
  },
  "effort": {
    "levels": [
      "low",
      "high",
      "max"
    ],
    "default": "max",
    "reserveShare": 0.12
  },
  "roles": {
    "plan": "max",
    "build": "max",
    "reviewer": "max",
    "locate": "low",
    "verify": "low"
  },
  "prune": {
    "enabled": true,
    "keepRecentToolCalls": 6,
    "keepRecentTurns": 3,
    "keepUserMessages": true
  },
  "fallback": [
    "glm-5.3-flash-free",
    "beam-free"
  ]
}
